{
  "feature_name": "sequential-doc-generation",
  "description": "Update /generate-docs to call generate_individual_doc 5 times sequentially instead of generate_foundation_docs all at once",
  "category": "improvement",
  "priority": "high",
  "created": "2025-12-25T19:11:02.3192037Z",
  "status": "stub"
}
